{
  "workflowId": "writer.section_generation",
  "runId": "run-valid-generation-001",
  "workspaceId": "workspace-demo-pharma",
  "documentId": "document-clinical-overview",
  "section": {
    "sectionId": "section-clinical-summary",
    "title": "Clinical Summary",
    "intent": "Summarize the primary efficacy result using only supplied evidence."
  },
  "evidence_chunks": [
    {
      "chunkId": "chunk-clinical-001",
      "sourceId": "source-study-report-demo",
      "quote": "The treatment group demonstrated a statistically significant improvement in the primary efficacy endpoint compared with placebo.",
      "pageNumber": 12,
      "sectionTitle": "Primary Efficacy Endpoint",
      "metadata": {
        "documentType": "clinical-study-report",
        "studyId": "study-demo-101"
      }
    }
  ],
  "generation": {
    "providerPreference": "auto",
    "temperature": 0.2
  }
}
